{
	"name": "Cloud-Bridge",
	"author": "anweisen",
	"version": "1.0",
	"main": "net.anweisen.cloud.modules.bridge.CloudBridgeModule",
	"website": "https://github.com/anweisen/DyCloud",
	"description": "Runtime module to enable the use of player management possible",
	"environment": "NONE",
	"copy": "ALL"
}
